{
  "categories": {
    "completedAndPending": [
      {
        "factId": "a02-progress",
        "note": "不通过：遗漏 crash-safe compaction 是当前核心缺口，并把下一步改成泛化审查，未指向先设计崩溃安全压缩测试。",
        "verdict": "partial"
      }
    ],
    "criticalConstraints": [
      {
        "factId": "a02-constraint-offline",
        "note": "Human reviewer confirmed the target output preserves: The index must work fully offline.",
        "verdict": "preserved"
      },
      {
        "factId": "a02-constraint-native",
        "note": "Human reviewer confirmed the target output preserves: Do not require native dependencies on supported platforms.",
        "verdict": "preserved"
      }
    ],
    "decisionsAndFailedAttempts": [
      {
        "factId": "a02-failed-sqlite",
        "note": "不通过：遗漏 crash-safe compaction 是当前核心缺口，并把下一步改成泛化审查，未指向先设计崩溃安全压缩测试。",
        "verdict": "partial"
      },
      {
        "factId": "a02-decision-jsonl",
        "note": "Human reviewer confirmed the target output preserves: Use append-only JSONL until 10,000-session startup exceeds two seconds.",
        "verdict": "preserved"
      }
    ],
    "nextAction": [
      {
        "factId": "a02-next",
        "note": "不通过：遗漏 crash-safe compaction 是当前核心缺口，并把下一步改成泛化审查，未指向先设计崩溃安全压缩测试。",
        "verdict": "contradicted"
      }
    ],
    "objectiveAndState": [
      {
        "factId": "a02-objective",
        "note": "不通过：遗漏 crash-safe compaction 是当前核心缺口，并把下一步改成泛化审查，未指向先设计崩溃安全压缩测试。",
        "verdict": "partial"
      }
    ],
    "workspaceEvidence": [
      {
        "factId": "a02-workspace",
        "note": "不通过：遗漏 crash-safe compaction 是当前核心缺口，并把下一步改成泛化审查，未指向先设计崩溃安全压缩测试。",
        "verdict": "partial"
      }
    ]
  },
  "fixtureId": "architecture-02-session-index",
  "mode": "visible-transcript",
  "repeatedFailedPaths": [],
  "review": {
    "humanReviewer": "jettlin927",
    "llmJudge": {
      "advisoryOnly": true,
      "model": "OpenAI Codex"
    },
    "reviewedAt": "2026-07-21T15:02:55.025115Z"
  },
  "runId": "architecture-02-session-index:visible-transcript:initial",
  "schemaVersion": "1.0.0",
  "target": {
    "agent": "claude",
    "model": "gpt-5.6-sol",
    "provider": "cc-switch-codex-oauth",
    "settings": {
      "maxTurns": 1,
      "mcp": "empty-strict",
      "permissionMode": "plan",
      "persistence": "disabled",
      "settingSources": "user",
      "slashCommands": "disabled",
      "systemPromptSha256": "9f380f2bc0f94a9164ac3cd8991044b19fab7e9359a40fa75697481f043f3982",
      "tools": "disabled"
    }
  },
  "tokens": {
    "input": 1450,
    "visibleTranscriptBaseline": 1450
  },
  "unsupportedClaims": []
}
