{
  "categories": {
    "completedAndPending": [
      {
        "factId": "d02-progress",
        "note": "Human reviewer confirmed the target output preserves: Windows-aware comparison and unit tests are complete; real watcher integration remains pending.",
        "verdict": "preserved"
      }
    ],
    "criticalConstraints": [
      {
        "factId": "d02-constraint-deps",
        "note": "Human reviewer confirmed the target output preserves: Do not add a watcher dependency.",
        "verdict": "preserved"
      },
      {
        "factId": "d02-constraint-posix",
        "note": "Human reviewer confirmed the target output preserves: Keep POSIX path comparison case-sensitive.",
        "verdict": "preserved"
      }
    ],
    "decisionsAndFailedAttempts": [
      {
        "factId": "d02-failed-utf8",
        "note": "Human reviewer confirmed the target output preserves: UTF-8 corruption was rejected because the decoded path matched exactly.",
        "verdict": "preserved"
      },
      {
        "factId": "d02-decision-case",
        "note": "Human reviewer confirmed the target output preserves: Use case-insensitive path comparison only on Windows.",
        "verdict": "preserved"
      }
    ],
    "nextAction": [
      {
        "factId": "d02-next",
        "note": "Human reviewer confirmed the target output preserves: Finish and run the Windows watcher integration test using the Chinese path.",
        "verdict": "preserved"
      }
    ],
    "objectiveAndState": [
      {
        "factId": "d02-objective",
        "note": "Human reviewer confirmed the target output preserves: Restore Windows reloads for Chinese paths; comparison code is changed and integration coverage is incomplete.",
        "verdict": "preserved"
      }
    ],
    "workspaceEvidence": [
      {
        "factId": "d02-workspace",
        "note": "Human reviewer confirmed the target output preserves: src/watch-path.ts is modified and test/watch-windows.test.ts is new.",
        "verdict": "preserved"
      }
    ]
  },
  "fixtureId": "debugging-02-unicode-watcher",
  "mode": "source-assisted-capsule",
  "repeatedFailedPaths": [],
  "review": {
    "humanReviewer": "jettlin927",
    "llmJudge": {
      "advisoryOnly": true,
      "model": "OpenAI Codex"
    },
    "reviewedAt": "2026-07-21T15:02:55.025115Z"
  },
  "runId": "debugging-02-unicode-watcher:source-assisted-capsule:initial",
  "schemaVersion": "1.0.0",
  "target": {
    "agent": "claude",
    "model": "gpt-5.6-sol",
    "provider": "cc-switch-codex-oauth",
    "settings": {
      "maxTurns": 1,
      "mcp": "empty-strict",
      "permissionMode": "plan",
      "persistence": "disabled",
      "settingSources": "user",
      "slashCommands": "disabled",
      "systemPromptSha256": "9f380f2bc0f94a9164ac3cd8991044b19fab7e9359a40fa75697481f043f3982",
      "tools": "disabled"
    }
  },
  "tokens": {
    "input": 2550,
    "visibleTranscriptBaseline": 1429
  },
  "unsupportedClaims": []
}
