{
  "categories": {
    "completedAndPending": [
      {
        "factId": "f01-progress",
        "note": "Human reviewer confirmed the target output preserves: Cursor parsing and list compatibility pass; pages() and its tests remain pending.",
        "verdict": "preserved"
      }
    ],
    "criticalConstraints": [
      {
        "factId": "f01-constraint-compat",
        "note": "Human reviewer confirmed the target output preserves: Keep the existing single-page list method compatible.",
        "verdict": "preserved"
      },
      {
        "factId": "f01-constraint-prefetch",
        "note": "Human reviewer confirmed the target output preserves: Do not prefetch pages; one iterator step fetches one page.",
        "verdict": "preserved"
      }
    ],
    "decisionsAndFailedAttempts": [
      {
        "factId": "f01-failed-eager",
        "note": "Human reviewer confirmed the target output preserves: Eager collectAll was deleted because it violated the no-prefetch constraint.",
        "verdict": "preserved"
      },
      {
        "factId": "f01-decision-iterator",
        "note": "Human reviewer confirmed the target output preserves: The new interface is an async iterator named pages().",
        "verdict": "preserved"
      }
    ],
    "nextAction": [
      {
        "factId": "f01-next",
        "note": "不通过：核心方案正确，但把唯一下一步改为直接实现 pages()，跳过先建立 one-page-per-next 行为测试，无法锁定无预取与兼容性。",
        "verdict": "contradicted"
      }
    ],
    "objectiveAndState": [
      {
        "factId": "f01-objective",
        "note": "Human reviewer confirmed the target output preserves: Add cursor pagination; response parsing is done and the async iterator is missing.",
        "verdict": "preserved"
      }
    ],
    "workspaceEvidence": [
      {
        "factId": "f01-workspace",
        "note": "不通过：核心方案正确，但把唯一下一步改为直接实现 pages()，跳过先建立 one-page-per-next 行为测试，无法锁定无预取与兼容性。",
        "verdict": "missing"
      }
    ]
  },
  "fixtureId": "feature-01-pagination",
  "mode": "visible-transcript",
  "repeatedFailedPaths": [],
  "review": {
    "humanReviewer": "jettlin927",
    "llmJudge": {
      "advisoryOnly": true,
      "model": "OpenAI Codex"
    },
    "reviewedAt": "2026-07-21T15:02:55.025115Z"
  },
  "runId": "feature-01-pagination:visible-transcript:initial",
  "schemaVersion": "1.0.0",
  "target": {
    "agent": "claude",
    "model": "gpt-5.6-sol",
    "provider": "cc-switch-codex-oauth",
    "settings": {
      "maxTurns": 1,
      "mcp": "empty-strict",
      "permissionMode": "plan",
      "persistence": "disabled",
      "settingSources": "user",
      "slashCommands": "disabled",
      "systemPromptSha256": "9f380f2bc0f94a9164ac3cd8991044b19fab7e9359a40fa75697481f043f3982",
      "tools": "disabled"
    }
  },
  "tokens": {
    "input": 1436,
    "visibleTranscriptBaseline": 1436
  },
  "unsupportedClaims": []
}
