{
  "categories": {
    "completedAndPending": [
      {
        "factId": "f02-progress",
        "note": "通过：虽遗漏部分已完成状态与文件证据，仍正确要求在 executor 构造前返回，并用不 mock 文件系统的测试证明无副作用。",
        "verdict": "partial"
      }
    ],
    "criticalConstraints": [
      {
        "factId": "f02-constraint-network",
        "note": "Human reviewer confirmed the target output preserves: Dry-run makes no network requests.",
        "verdict": "preserved"
      },
      {
        "factId": "f02-constraint-files",
        "note": "Human reviewer confirmed the target output preserves: Dry-run writes no files or directories.",
        "verdict": "preserved"
      }
    ],
    "decisionsAndFailedAttempts": [
      {
        "factId": "f02-failed-mock",
        "note": "Human reviewer confirmed the target output preserves: Filesystem mocking in the CLI test was rejected because it hid real writes.",
        "verdict": "preserved"
      },
      {
        "factId": "f02-decision-plan",
        "note": "Human reviewer confirmed the target output preserves: Planning must be pure and separate from executor construction.",
        "verdict": "preserved"
      }
    ],
    "nextAction": [
      {
        "factId": "f02-next",
        "note": "通过：虽遗漏部分已完成状态与文件证据，仍正确要求在 executor 构造前返回，并用不 mock 文件系统的测试证明无副作用。",
        "verdict": "partial"
      }
    ],
    "objectiveAndState": [
      {
        "factId": "f02-objective",
        "note": "通过：虽遗漏部分已完成状态与文件证据，仍正确要求在 executor 构造前返回，并用不 mock 文件系统的测试证明无副作用。",
        "verdict": "partial"
      }
    ],
    "workspaceEvidence": [
      {
        "factId": "f02-workspace",
        "note": "通过：虽遗漏部分已完成状态与文件证据，仍正确要求在 executor 构造前返回，并用不 mock 文件系统的测试证明无副作用。",
        "verdict": "missing"
      }
    ]
  },
  "fixtureId": "feature-02-deploy-dry-run",
  "mode": "visible-transcript",
  "repeatedFailedPaths": [],
  "review": {
    "humanReviewer": "jettlin927",
    "llmJudge": {
      "advisoryOnly": true,
      "model": "OpenAI Codex"
    },
    "reviewedAt": "2026-07-21T15:02:55.025115Z"
  },
  "runId": "feature-02-deploy-dry-run:visible-transcript:initial",
  "schemaVersion": "1.0.0",
  "target": {
    "agent": "claude",
    "model": "gpt-5.6-sol",
    "provider": "cc-switch-codex-oauth",
    "settings": {
      "maxTurns": 1,
      "mcp": "empty-strict",
      "permissionMode": "plan",
      "persistence": "disabled",
      "settingSources": "user",
      "slashCommands": "disabled",
      "systemPromptSha256": "9f380f2bc0f94a9164ac3cd8991044b19fab7e9359a40fa75697481f043f3982",
      "tools": "disabled"
    }
  },
  "tokens": {
    "input": 1434,
    "visibleTranscriptBaseline": 1434
  },
  "unsupportedClaims": []
}
