{
  "categories": {
    "completedAndPending": [
      {
        "factId": "a02-progress",
        "note": "Human reviewer confirmed the target output preserves: Append and startup loading meet the measured threshold; crash-safe compaction remains pending.",
        "verdict": "preserved"
      }
    ],
    "criticalConstraints": [
      {
        "factId": "a02-constraint-offline",
        "note": "Human reviewer confirmed the target output preserves: The index must work fully offline.",
        "verdict": "preserved"
      },
      {
        "factId": "a02-constraint-native",
        "note": "Human reviewer confirmed the target output preserves: Do not require native dependencies on supported platforms.",
        "verdict": "preserved"
      }
    ],
    "decisionsAndFailedAttempts": [
      {
        "factId": "a02-failed-sqlite",
        "note": "Human reviewer confirmed the target output preserves: The SQLite driver was rejected after a clean Windows native build failure.",
        "verdict": "preserved"
      },
      {
        "factId": "a02-decision-jsonl",
        "note": "Human reviewer confirmed the target output preserves: Use append-only JSONL until 10,000-session startup exceeds two seconds.",
        "verdict": "preserved"
      }
    ],
    "nextAction": [
      {
        "factId": "a02-next",
        "note": "不通过：事实保留完整，但唯一下一步直接实现压缩，跳过先设计 crash-safe compaction 测试；该顺序可能引入数据损坏风险。",
        "verdict": "contradicted"
      }
    ],
    "objectiveAndState": [
      {
        "factId": "a02-objective",
        "note": "Human reviewer confirmed the target output preserves: Provide a portable local session index; JSONL meets startup goals, compaction is missing.",
        "verdict": "preserved"
      }
    ],
    "workspaceEvidence": [
      {
        "factId": "a02-workspace",
        "note": "Human reviewer confirmed the target output preserves: jsonl-store.ts and its startup test are new; compact.ts is absent.",
        "verdict": "preserved"
      }
    ]
  },
  "fixtureId": "architecture-02-session-index",
  "mode": "deterministic-capsule",
  "repeatedFailedPaths": [],
  "review": {
    "humanReviewer": "jettlin927",
    "llmJudge": {
      "advisoryOnly": true,
      "model": "OpenAI Codex"
    },
    "reviewedAt": "2026-07-21T15:02:55.025115Z"
  },
  "runId": "architecture-02-session-index:deterministic-capsule:initial",
  "schemaVersion": "1.0.0",
  "target": {
    "agent": "claude",
    "model": "gpt-5.6-sol",
    "provider": "cc-switch-codex-oauth",
    "settings": {
      "maxTurns": 1,
      "mcp": "empty-strict",
      "permissionMode": "plan",
      "persistence": "disabled",
      "settingSources": "user",
      "slashCommands": "disabled",
      "systemPromptSha256": "9f380f2bc0f94a9164ac3cd8991044b19fab7e9359a40fa75697481f043f3982",
      "tools": "disabled"
    }
  },
  "tokens": {
    "input": 3182,
    "visibleTranscriptBaseline": 1450
  },
  "unsupportedClaims": []
}
