{
  "categories": {
    "completedAndPending": [
      {
        "factId": "a01-progress",
        "note": "不通过：遗漏慢消费者背压挂起这一当前阻塞及 SQLite 预索引的已否定证据，且把唯一下一步错误地转向可选索引，可能导致续接方向跑偏。",
        "verdict": "partial"
      }
    ],
    "criticalConstraints": [
      {
        "factId": "a01-constraint-memory",
        "note": "Human reviewer confirmed the target output preserves: Peak memory must remain below 100 MiB.",
        "verdict": "preserved"
      },
      {
        "factId": "a01-constraint-order",
        "note": "Human reviewer confirmed the target output preserves: Preserve source event order.",
        "verdict": "preserved"
      }
    ],
    "decisionsAndFailedAttempts": [
      {
        "factId": "a01-failed-sqlite",
        "note": "不通过：遗漏慢消费者背压挂起这一当前阻塞及 SQLite 预索引的已否定证据，且把唯一下一步错误地转向可选索引，可能导致续接方向跑偏。",
        "verdict": "missing"
      },
      {
        "factId": "a01-decision-stream",
        "note": "Human reviewer confirmed the target output preserves: Stream lines on first read; a later index may remain optional.",
        "verdict": "preserved"
      }
    ],
    "nextAction": [
      {
        "factId": "a01-next",
        "note": "不通过：遗漏慢消费者背压挂起这一当前阻塞及 SQLite 预索引的已否定证据，且把唯一下一步错误地转向可选索引，可能导致续接方向跑偏。",
        "verdict": "contradicted"
      }
    ],
    "objectiveAndState": [
      {
        "factId": "a01-objective",
        "note": "不通过：遗漏慢消费者背压挂起这一当前阻塞及 SQLite 预索引的已否定证据，且把唯一下一步错误地转向可选索引，可能导致续接方向跑偏。",
        "verdict": "partial"
      }
    ],
    "workspaceEvidence": [
      {
        "factId": "a01-workspace",
        "note": "不通过：遗漏慢消费者背压挂起这一当前阻塞及 SQLite 预索引的已否定证据，且把唯一下一步错误地转向可选索引，可能导致续接方向跑偏。",
        "verdict": "partial"
      }
    ]
  },
  "fixtureId": "architecture-01-streaming-log",
  "mode": "visible-transcript",
  "repeatedFailedPaths": [],
  "review": {
    "humanReviewer": "jettlin927",
    "llmJudge": {
      "advisoryOnly": true,
      "model": "OpenAI Codex"
    },
    "reviewedAt": "2026-07-21T15:02:55.025115Z"
  },
  "runId": "architecture-01-streaming-log:visible-transcript:initial",
  "schemaVersion": "1.0.0",
  "target": {
    "agent": "claude",
    "model": "gpt-5.6-sol",
    "provider": "cc-switch-codex-oauth",
    "settings": {
      "maxTurns": 1,
      "mcp": "empty-strict",
      "permissionMode": "plan",
      "persistence": "disabled",
      "settingSources": "user",
      "slashCommands": "disabled",
      "systemPromptSha256": "9f380f2bc0f94a9164ac3cd8991044b19fab7e9359a40fa75697481f043f3982",
      "tools": "disabled"
    }
  },
  "tokens": {
    "input": 1446,
    "visibleTranscriptBaseline": 1446
  },
  "unsupportedClaims": []
}
