{
  "categories": {
    "completedAndPending": [
      {
        "factId": "a03-progress",
        "note": "通过：虽缺精确文件状态及部分失败表现细节，但正确保留并发/FIFO/取消约束、禁止轮询路径和修复取消等待者的下一步。",
        "verdict": "partial"
      }
    ],
    "criticalConstraints": [
      {
        "factId": "a03-constraint-limit",
        "note": "Human reviewer confirmed the target output preserves: Never run more than four jobs concurrently.",
        "verdict": "preserved"
      },
      {
        "factId": "a03-constraint-order",
        "note": "Human reviewer confirmed the target output preserves: Preserve FIFO start order among non-cancelled jobs.",
        "verdict": "preserved"
      },
      {
        "factId": "a03-constraint-cancel",
        "note": "Human reviewer confirmed the target output preserves: A queued job can be cancelled before it starts.",
        "verdict": "preserved"
      }
    ],
    "decisionsAndFailedAttempts": [
      {
        "factId": "a03-failed-polling",
        "note": "Human reviewer confirmed the target output preserves: Polling was rejected because of start latency and flaky timing tests.",
        "verdict": "preserved"
      },
      {
        "factId": "a03-decision-release",
        "note": "Human reviewer confirmed the target output preserves: A completed job directly releases the next FIFO waiter.",
        "verdict": "preserved"
      }
    ],
    "nextAction": [
      {
        "factId": "a03-next",
        "note": "Human reviewer confirmed the target output preserves: Fix queued-waiter removal so cancellation test passes without weakening FIFO or concurrency four.",
        "verdict": "preserved"
      }
    ],
    "objectiveAndState": [
      {
        "factId": "a03-objective",
        "note": "通过：虽缺精确文件状态及部分失败表现细节，但正确保留并发/FIFO/取消约束、禁止轮询路径和修复取消等待者的下一步。",
        "verdict": "partial"
      }
    ],
    "workspaceEvidence": [
      {
        "factId": "a03-workspace",
        "note": "通过：虽缺精确文件状态及部分失败表现细节，但正确保留并发/FIFO/取消约束、禁止轮询路径和修复取消等待者的下一步。",
        "verdict": "missing"
      }
    ]
  },
  "fixtureId": "architecture-03-job-scheduler",
  "mode": "visible-transcript",
  "repeatedFailedPaths": [],
  "review": {
    "humanReviewer": "jettlin927",
    "llmJudge": {
      "advisoryOnly": true,
      "model": "OpenAI Codex"
    },
    "reviewedAt": "2026-07-21T15:02:55.025115Z"
  },
  "runId": "architecture-03-job-scheduler:visible-transcript:initial",
  "schemaVersion": "1.0.0",
  "target": {
    "agent": "claude",
    "model": "gpt-5.6-sol",
    "provider": "cc-switch-codex-oauth",
    "settings": {
      "maxTurns": 1,
      "mcp": "empty-strict",
      "permissionMode": "plan",
      "persistence": "disabled",
      "settingSources": "user",
      "slashCommands": "disabled",
      "systemPromptSha256": "9f380f2bc0f94a9164ac3cd8991044b19fab7e9359a40fa75697481f043f3982",
      "tools": "disabled"
    }
  },
  "tokens": {
    "input": 1431,
    "visibleTranscriptBaseline": 1431
  },
  "unsupportedClaims": []
}
