{
  "categories": {
    "completedAndPending": [
      {
        "factId": "r03-progress",
        "note": "不通过：遗漏已完成的 symlink-cycle 防护及“目录 identity 仅用于循环检测”的关键决策；修改遍历时可能破坏跨平台和循环安全。",
        "verdict": "partial"
      }
    ],
    "criticalConstraints": [
      {
        "factId": "r03-constraint-platforms",
        "note": "Human reviewer confirmed the target output preserves: Preserve Windows, macOS, and Linux behavior.",
        "verdict": "preserved"
      },
      {
        "factId": "r03-constraint-streaming",
        "note": "Human reviewer confirmed the target output preserves: Do not load all file contents into memory.",
        "verdict": "preserved"
      }
    ],
    "decisionsAndFailedAttempts": [
      {
        "factId": "r03-failed-realpath",
        "note": "Human reviewer confirmed the target output preserves: Rewriting every presented path through realpath was rejected because it changed Windows junction paths.",
        "verdict": "preserved"
      },
      {
        "factId": "r03-decision-identity",
        "note": "不通过：遗漏已完成的 symlink-cycle 防护及“目录 identity 仅用于循环检测”的关键决策；修改遍历时可能破坏跨平台和循环安全。",
        "verdict": "missing"
      }
    ],
    "nextAction": [
      {
        "factId": "r03-next",
        "note": "不通过：遗漏已完成的 symlink-cycle 防护及“目录 identity 仅用于循环检测”的关键决策；修改遍历时可能破坏跨平台和循环安全。",
        "verdict": "partial"
      }
    ],
    "objectiveAndState": [
      {
        "factId": "r03-objective",
        "note": "不通过：遗漏已完成的 symlink-cycle 防护及“目录 identity 仅用于循环检测”的关键决策；修改遍历时可能破坏跨平台和循环安全。",
        "verdict": "partial"
      }
    ],
    "workspaceEvidence": [
      {
        "factId": "r03-workspace",
        "note": "不通过：遗漏已完成的 symlink-cycle 防护及“目录 identity 仅用于循环检测”的关键决策；修改遍历时可能破坏跨平台和循环安全。",
        "verdict": "missing"
      }
    ]
  },
  "fixtureId": "refactor-03-file-indexer",
  "mode": "visible-transcript",
  "repeatedFailedPaths": [],
  "review": {
    "humanReviewer": "jettlin927",
    "llmJudge": {
      "advisoryOnly": true,
      "model": "OpenAI Codex"
    },
    "reviewedAt": "2026-07-21T15:02:55.025115Z"
  },
  "runId": "refactor-03-file-indexer:visible-transcript:initial",
  "schemaVersion": "1.0.0",
  "target": {
    "agent": "claude",
    "model": "gpt-5.6-sol",
    "provider": "cc-switch-codex-oauth",
    "settings": {
      "maxTurns": 1,
      "mcp": "empty-strict",
      "permissionMode": "plan",
      "persistence": "disabled",
      "settingSources": "user",
      "slashCommands": "disabled",
      "systemPromptSha256": "9f380f2bc0f94a9164ac3cd8991044b19fab7e9359a40fa75697481f043f3982",
      "tools": "disabled"
    }
  },
  "tokens": {
    "input": 1444,
    "visibleTranscriptBaseline": 1444
  },
  "unsupportedClaims": []
}
